{
  "session_id": "session_20250610_023813_f4650379",
  "job_posting": {
    "job_id": "job_20250610_023813",
    "title": "Data Scientist",
    "company": "Vodafone",
    "department": null,
    "location": null,
    "employment_type": null,
    "experience_level": null,
    "required_skills": [],
    "preferred_skills": [],
    "description": "Data Scientist - Vodafone\n\nLocation: London, UK (Hybrid - 3 days office, 2 days remote) | Other locations available: Manchester, Birmingham, Dublin Salary: ¬£65,000 - ¬£85,000 (depending on experience) + performance bonus Visa Sponsorship: Available for qualified candidates\n\nJoin Vodafone, a global leader in telecommunications and digital services, where innovation meets impact. We're transforming how the world connects, and we need exceptional data scientists to drive our digital future.\n\nAbout Vodafone\n\nAt Vodafone, we connect millions of people, businesses, and communities worldwide. Our cutting-edge technology and data-driven approach power everything from 5G networks to IoT solutions. We're not just a telecom company ‚Äì we're architects of the digital future, creating solutions that matter.\n\nOur Commitment to Diversity: With 40% of our tech workforce identifying as women and active Employee Resource Groups including Pride, Cultural Diversity Network, and Parents & Carers, we're building an inclusive environment where everyone thrives.\n\nThe Opportunity\n\nWe're seeking a talented Data Scientist to join our 25-person Advanced Analytics team within the Digital Innovation department. You'll help unlock the power of data to revolutionize customer experiences and drive business growth. Working with massive datasets, cutting-edge technologies, and brilliant minds, you'll solve complex challenges in telecommunications.\n\nCurrent Team Impact:\n\nReduced customer churn by 23% through predictive modeling\nSaved ¬£12M annually through network optimization algorithms\nImproved customer satisfaction scores by 18% via personalization engines\n\nWhat You'll Do\n\nüîπ Develop and implement advanced machine learning models to optimize network performance and predict customer behavior\n\nüîπ Analyze petabytes of network and customer data to uncover actionable insights that drive strategic decisions\n\nüîπ Build predictive models for customer churn, network optimization, and revenue forecasting using TensorFlow, PyTorch, and scikit-learn\n\nüîπ Collaborate with cross-functional teams including engineering, product, and business stakeholders to deliver data-driven solutions\n\nüîπ Design and maintain scalable data pipelines and analytics infrastructure\n\nüîπ Create compelling data visualizations and presentations to communicate complex findings to technical and non-technical audiences\n\nüîπ Lead A/B testing initiatives to optimize customer experiences across digital touchpoints\n\nüîπ Mentor junior team members and contribute to the growth of our data science practice\n\nCurrent Projects You'll Contribute To\n\nüéØ 5G Network Intelligence: Building ML models to optimize 5G network deployment and performance\n\nüéØ Customer 360 Platform: Creating unified customer profiles using graph analytics and deep learning\n\nüéØ IoT Anomaly Detection: Developing real-time fraud detection for millions of connected devices\n\nüéØ Conversational AI: Enhancing customer service chatbots with NLP and sentiment analysis\n\nWhat We're Looking For\n\n‚úÖ Master's degree in Computer Science, Statistics, Mathematics, or related field (PhD preferred)\n\n‚úÖ 3+ years of hands-on experience in data science, preferably in telecommunications or technology\n\n‚úÖ Expert proficiency in Python, R, and SQL with experience in big data technologies (Spark, Hadoop)\n\n‚úÖ Strong foundation in machine learning algorithms, statistical modeling, and deep learning frameworks (TensorFlow, PyTorch, Keras)\n\n‚úÖ Experience with cloud platforms (AWS, Azure, or GCP) and distributed computing\n\n‚úÖ Proven track record of deploying models into production environments using MLOps practices\n\n‚úÖ Excellent problem-solving skills with the ability to work with ambiguous requirements\n\n‚úÖ Outstanding communication skills with the ability to translate complex technical concepts for diverse audiences\n\nWhat Sets You Apart\n\nüìä Experience with telecom-specific datasets (CDR, network logs, IoT data)\n\nüìä Knowledge of 5G technology and its data implications\n\nüìä Published research or contributions to open-source projects\n\nüìä Experience with real-time analytics and streaming data platforms (Kafka, Flink)\n\nWhat We Offer\n\nüöÄ Competitive salary package (¬£65,000 - ¬£85,000) with performance-based bonuses\n\nüöÄ Comprehensive health, dental, and vision coverage for you and your family\n\nüöÄ Flexible working arrangements: 3 days office, 2 days remote\n\nüöÄ Generous annual leave (28 days) and sabbatical opportunities\n\nüöÄ Access to cutting-edge technology and ¬£2,000 annual learning budget\n\nüöÄ Continuous learning opportunities including conferences, certifications, and internal training programs\n\nüöÄ Career development pathways with global mobility opportunities\n\nüöÄ Employee stock purchase plan and 10% retirement savings matching\n\nüöÄ Wellness programs and mental health support through dedicated apps\n\nüöÄ Discounted Vodafone products and services (50% off)\n\nYour Impact After One Year\n\nBy your first anniversary, you'll have:\n\nDeployed at least 3 production-ready ML models improving key business metrics\nReduced customer churn by measurable percentage through predictive analytics\nOptimized network efficiency resulting in cost savings\nEstablished yourself as a trusted data expert within the organization\nContributed to strategic initiatives shaping Vodafone's digital transformation\nInterview Process\n\nTimeline: 3-4 weeks from application to offer\n\n1Ô∏è‚É£ Initial screening call with recruiter (30 mins)\n\n2Ô∏è‚É£ Technical assessment (take-home or live coding - your choice)\n\n3Ô∏è‚É£ Virtual panel interview with team members (90 mins)\n\n4Ô∏è‚É£ Final interview with department head (45 mins)\n\n5Ô∏è‚É£ Reference checks and offer\n\nReady to Shape the Future of Connectivity?\n\nIf you're passionate about using data to solve real-world problems and want to work at the forefront of telecommunications innovation, we want to hear from you.\n\nApplication Deadline: July 4, 2025\n\nVodafone is an equal opportunity employer committed to building a diverse and inclusive workforce. We welcome applications from all qualified candidates regardless of race, gender, age, sexual orientation, disability, or any other characteristic protected by law.\n\nJoin us in creating a better connected future for everyone.\n\n#DataScience #MachineLearning #Telecommunications #HybridWork #TechJobs #Vodafone #DataScientist #London #UK\n",
    "requirements": null,
    "responsibilities": null,
    "education_requirements": null,
    "salary_range": null,
    "benefits": null,
    "created_at": "2025-06-10T02:38:13.256870"
  },
  "uploaded_files": [
    "data\\cvs\\pending\\ee04360f1fe341d0973c1113ee0f51f6_Suraiyaa Zabeen.txt",
    "data\\cvs\\pending\\b3d2f73737e140208eab74c2b79d571f_Jack Townsend.txt",
    "data\\cvs\\pending\\7dc6edd695e440369a560897fd1e8410_Neethu Muraleedharan.txt",
    "data\\cvs\\pending\\95615a2a092f4fdd9a80837893825521_Taiyu Xie.txt",
    "data\\cvs\\pending\\92372e2388fb441e956bd8cbb894f275_G√ºl √áetin.txt",
    "data\\cvs\\pending\\942d9124626d46a3a447ba664b20397b_Sahil Hussain.txt",
    "data\\cvs\\pending\\99cd4f83d50d4245ba92351c5ed7b469_Sharaf M.txt",
    "data\\cvs\\pending\\067b812f2a3744e1a5cb4e1e21a75ca4_Siddhesh Sathe.txt",
    "data\\cvs\\pending\\9bb7c4359d0f473093830d875f88bd86_Saad LAOUADI.txt"
  ],
  "candidates": [
    {
      "candidate_id": "ee04360f1fe341d0973c_20250610_023908_151f2a3f",
      "file_name": "ee04360f1fe341d0973c1113ee0f51f6_Suraiyaa Zabeen.txt",
      "full_name": "Dr. Suraiyaa Zabeen",
      "contact_info": {
        "email": null,
        "phone": null,
        "location": "London, England, United Kingdom",
        "linkedin": "www.linkedin.com/in/suraiyazabeen",
        "github": null
      },
      "summary": "I have 12 years of experience working in research and development of aerospace materials. In 2014, I founded Trustworthy foundation, a mental health charity for furthering children's mental health education, to raise awareness about learning disability and to support staff at all educational levels.",
      "skills": [
        "Communication",
        "Software Development",
        "Materials Science",
        "Data Science",
        "Machine Learning",
        "Research and Development",
        "Aerospace Materials",
        "Stress Management",
        "Emotional Intelligence",
        "Leadership Development",
        "Synchrotron X-ray",
        "Neutron Diffraction",
        "Light Microscopy",
        "FEGSEM",
        "Vickers Hardness Testing",
        "Instrumented Indentation",
        "Tensile Testing",
        "Chemical Analysis",
        "Laboratory Equipment Operation"
      ],
      "experience": [
        {
          "title": "Data Scientist",
          "company": "Agilance Property",
          "start_date": "09/2023",
          "end_date": "Present",
          "duration_months": 22,
          "description": null,
          "achievements": []
        },
        {
          "title": "Founder",
          "company": "Trustworthy Foundation UK",
          "start_date": "2014",
          "end_date": "04/2024",
          "duration_months": 120,
          "description": "We provide unique, training on stress management, anxiety, resilience, and emotional intelligence that will help your people perform better",
          "achievements": [
            "Emotional Intelligence",
            "Performance under Stress",
            "Employee Wellbeing",
            "Leadership Development",
            "Conflict resolution",
            "Stress and Anxiety Management",
            "Recovery Support Program for high achievers"
          ]
        },
        {
          "title": "Software Engineer",
          "company": "Bank of America",
          "start_date": "10/2022",
          "end_date": "09/2023",
          "duration_months": 12,
          "description": null,
          "achievements": []
        },
        {
          "title": "Data Science and Machine Learning Educator",
          "company": "Flourishing-Life Ai",
          "start_date": "11/2018",
          "end_date": "01/2023",
          "duration_months": 51,
          "description": null,
          "achievements": []
        },
        {
          "title": "Senior Research Scientist",
          "company": "Coventry University",
          "start_date": "09/2016",
          "end_date": "01/2018",
          "duration_months": 17,
          "description": "Tasked with leading, planning and executing a range of research projects in respect of the structural integrity of aerospace components including preparing proposals and completing individual and collaborative research projects",
          "achievements": [
            "Supervised research students",
            "Instrumental in collating, conceptualising and publishing research findings in journal articles",
            "Trained and coached staff, Technician, PhD, MSc and undergraduate students",
            "Developed and managed relationships with external partners, academics and industrial partners",
            "Played a pivotal role in supporting the University's contract proposal to the ESA (European Space Agency) as key facilitator"
          ]
        },
        {
          "title": "Senior Research Scientist",
          "company": "Coventry University",
          "start_date": "05/2014",
          "end_date": "09/2016",
          "duration_months": 29,
          "description": "Primarily accountable for collating, reviewing and publishing research findings in journal articles for the project",
          "achievements": [
            "Played a key role in defining and developing new and existing research proposals, grants and funding applications",
            "Built, managed and maintained effective relationships with industrial partners and academics",
            "Managed and coordinated laboratory functions including purchasing, inventory management, health and safety",
            "Identified, planned and managed small scale research activities and devised new research methodologies"
          ]
        },
        {
          "title": "Post Doctoral Research Associate",
          "company": "The Open University",
          "start_date": "01/2013",
          "end_date": "05/2014",
          "duration_months": 17,
          "description": "Project: The effect of laser shock peening on the hardening and residual stress response in Al 2624 alloy",
          "achievements": [
            "Conducted literature review on the subject that involved around 200 technical papers",
            "Conducted scientific experiments using high-energy Synchrotron X-ray and Neutron Diffraction",
            "Carried out data analysis using a combination of scientific software",
            "Presented research outcomes in the national and international conferences",
            "Published results in the top quartile (Q1) scientific journals"
          ]
        },
        {
          "title": "Lloyd's Register Educational Trust Research Collegium",
          "company": "University of Southampton",
          "start_date": "07/2012",
          "end_date": "09/2012",
          "duration_months": 3,
          "description": "Attended Llyds' register educational trust research collegium",
          "achievements": []
        },
        {
          "title": "Research Consultant",
          "company": "The University of Manchester",
          "start_date": "01/2011",
          "end_date": "03/2012",
          "duration_months": 15,
          "description": "Project: Characterization of residual stresses in laser shock peened Ti-6Al-4V discs by Contour method",
          "achievements": [
            "Investigation of residual stresses in laser shock peened double edge notched Al 7050 alloy"
          ]
        },
        {
          "title": "Chemical Analyst and Design Engineer",
          "company": "Holcim Bangladesh Ltd.",
          "start_date": "06/2005",
          "end_date": "06/2006",
          "duration_months": 13,
          "description": "Performed chemical analysis (routine and non-routine) analysis of products using standard operating procedures",
          "achievements": [
            "Conceptualised, produced and executed chemical testing procedures and ensured documentation was updated",
            "Operated a range of laboratory equipment safely, evaluated and reported test results to managers",
            "Tasked with maintaining, monitoring and updating the inventory of chemicals and supplies",
            "Liaised with production department to ensure quality",
            "Handled customer complaints",
            "Maintained products certification by getting them tested by external certification bodies such as BSTI and BUET"
          ]
        }
      ],
      "education": [
        {
          "degree": "Data Science/Machine Learning",
          "institution": "AiCore",
          "graduation_year": 2021,
          "gpa": null,
          "field_of_study": "Data Science/Machine Learning"
        },
        {
          "degree": "PhD",
          "institution": "The University of Manchester",
          "graduation_year": 2011,
          "gpa": null,
          "field_of_study": "Aerospace Materials"
        },
        {
          "degree": "MSc",
          "institution": "The University of Manchester",
          "graduation_year": 2007,
          "gpa": null,
          "field_of_study": "Advanced Engineering Materials"
        },
        {
          "degree": "BSc Engg.",
          "institution": "Bangladesh University of Engineering and Technology",
          "graduation_year": 2004,
          "gpa": null,
          "field_of_study": "Materials and Metallurgical Engg."
        }
      ],
      "certifications": [
        "Neural Networks and Deep Learning",
        "The Neuroscience of Learning",
        "Databases and SQL for Data Science",
        "Problem Solving Techniques",
        "Advanced Machine Learning and Signal Processing"
      ],
      "languages": [
        "English (Full Professional)",
        "Arabic (Limited Working)",
        "Hindi (Professional Working)"
      ],
      "projects": [
        "Effect of selective laser melting scanning strategy on the residual stress and texture of Ti-6Al-4V material",
        "Residual Stress Characterization in Friction Stir Welded Launchers Structures after Laser Shock Peening",
        "Effect of crystallographic texture on the residual stress generation by laser shock peening in Aluminium-Lithium alloy",
        "The effect of laser shock peening on the hardening and residual stress response in Al 2624 alloy",
        "Characterization of residual stresses in laser shock peened Ti-6Al-4V discs by Contour method",
        "Investigation of residual stresses in laser shock peened double edge notched Al 7050 alloy"
      ],
      "raw_text": "Contact\nwww.linkedin.com/in/\nsuraiyazabeen (LinkedIn)\nTop Skills\nCommunication\nSoftware Development\nMaterials Science\nLanguages\nEnglish (Full Professional)\nArabic (Limited Working)\nHindi (Professional Working)\nCertifications\nNeural Networks and Deep Learning\nThe Neuroscience of Learning\nDatabases and SQL for Data\nScience\nProblem Solving Techniques\nAdvanced Machine Learning and\nSignal Processing\nHonors-Awards\nAssociate Fellow of the Higher\nEducation Academy\nLloyd's Register Educational Trust\nScholarship\nPublications\nPolymetallic nodule mining:\nInnovative concepts for\ncommercialisation\nResidual stresses caused by headon\nand 45¬∞ foreign object damage\nfor a laser shock peened Ti‚Äì6Al‚Äì4V\nalloy aerofoil\nEffect of texture on the residual\nstress response from laser peening\nof an aluminium-lithium alloy\nMachine Learning-Based Prediction\nand Optimisation System for Laser\nShock Peening\nDr. Suraiyaa Zabeen\nData Scientist | Materials Science\nLondon, England, United Kingdom\nSummary\nI have 12 years of experience working in research and development\nof aerospace materials. In 2014, I founded Trustworthy foundation,\na mental health charity for furthering children's mental health\neducation, to raise awareness about learning disability and to\nsupport staff at all educational levels.\nExperience\nAgilance Property\nData Scientist\nSeptember 2023 - Present (1 year 10 months)\nTrustworthy Foundation UK\nFounder\n2014 - April 2024 (10 years)\nDhaka, Bangladesh\nWe provide unique, training on stress management, anxiety, resilience, and\nemotional intelligence that will help your people perform better\nOur Specialization:\n‚Ä¢ Emotional Intelligence\n‚Ä¢ Performance under Stress\n‚Ä¢ Employee Wellbeing\n‚Ä¢ Leadership Development\n‚Ä¢ Conflict resolution\n‚Ä¢ Stress and Anxiety Management\n‚Ä¢ Recovery Support Program for high achievers\nBank of America\nSoftware Engineer\nOctober 2022 - September 2023 (1 year)\nLondon, England, United Kingdom\nFlourishing-Life Ai\nData Science and Machine Learning Educator\nPage 1 of 5\nEFFECT OF PRESSURE ONTHE RESIDUAL STRESSDEVELOPMENT IN THE LINEARFRICTION WELDED Ti6246\nNovember 2018 - January 2023 (4 years 3 months)\nLondon, England, United Kingdom\nCoventry University\n3 years 9 months\nSenior Research Scientist\nSeptember 2016 - January 2018 (1 year 5 months)\nCoventry, United Kingdom\nKey Accountabilities1. Tasked with leading, planning and executing a range of research projects inrespect of the structural integrity of aerospace components including preparingproposals and completing individual and collaborative research projects2. Supervised research students.3. Instrumental in collating, conceptualising and publishing research findingsin journal articles and successfully contributed to the development andenhancement of new and existing research proposals and ideas4. Trained and coached staff, Technician, PhD, MSc and undergraduatestudents.5. Developed and managed relationships with external partners, academicsand industrial partners6. Provided technical assistance to colleagues and laboratory staff regardingproduct use7. Delivered training and supervision to students during their research topics8. Updated records, prepared technical papers and made technicalpresentations to develop publications9. Played a pivotal role in supporting the University‚Äôs contract proposal to theESA (European Space Agency) as key facilitatorKey Projects at Coventry University1. Effect of selective laser melting scanning strategy on the residual stressand texture of Ti-6Al-4V material (Funded by Coventry University FacultyResearch Centre in collaboration with Birmingham University)2. Residual Stress Characterization in Friction Stir Welded LaunchersStructures after Laser Shock Peening to enhance Stress-Corrosion Crackingand Fatigue Resistance (Funded by European Space Agency)\nSenior Research Scientist\nMay 2014 - September 2016 (2 years 5 months)\nCoventry, United Kingdom\nPage 2 of 5\nKey Accountabilities1. Primarily accountable for collating, reviewing and publishing researchfindings in journal articles for the project2. Played a key role in defining and developing new and existing researchproposals, grants and funding applications to external bodes for project/research funding and contractual requirements3. Built, managed and maintained effective relationships with industrialpartners and academics to support projects4. Managed and coordinated laboratory functions including purchasing,inventory management, health and safety, and training and development ofstudents, staff and external delegates5. Identified, planned and managed small scale research activities and devisednew research methodologies6. Instrumental in contributing to teaching and learning programs includingassessing students, supervising MSc and BSc research projects, developingstudent research skills and providing one-to-one tuition Key Projects1. Effect of crystallographic texture on the residual stress generation bylaser shock peening in Aluminium-Lithium alloy (Funded by Air Force Officeof Scientific Research, Air Force Material Command, USAF, under grant noFA8655-12-1-2084)\nThe Open University\nPost Doctoral Research Associate\nJanuary 2013 - May 2014 (1 year 5 months)\nMilton Keynes, United Kingdom\nProject: ‚ÄúThe effect of laser shock peening on the hardening and residualstress response in Al 2624 alloy‚Äù1. Conducted literature review on the subject that involved around 200technical papers2. Conducted scientific experiments using high-energy Synchrotron X-ray andNeutron Diffraction. 3. Carried out data analysis using a combination of scientific software. 4. Presented research outcomes in the national and international conferences5. Conducted investigation using light microscopy, FEGSEM, Vickers hardnesstesting, instrumented indentation, tensile testing.6. Published results in the top quartile (Q1) scientific journals.\nPage 3 of 5\nUniversity of Southampton\nLloyd's Register Educational Trust Research Collegium\nJuly 2012 - September 2012 (3 months)\nSouthampton, United Kingdom\nAttended Llyds' register educational trust research collegium\nThe University of Manchester\nResearch Consultant\nJanuary 2011 - March 2012 (1 year 3 months)\nManchester\n1. Project: ‚ÄúCharacterization of residual stresses in laser shock peenedTi-6Al-4V discs by Contour method‚Äô‚Äô 2. Project: ‚Äò‚ÄôInvestigation of residual stresses in laser shock peened doubleedge notched Al 7050 alloy‚Äô‚Äô\nHolcim Bangladesh Ltd.\nChemical Analyst and Design Engineer\nJune 2005 - June 2006 (1 year 1 month)\n‚Ä¢ Performed chemical analysis (routine and non-routine) analysis of productsusing standard operating procedures‚Ä¢ Conceptualised, produced and executed chemical testing procedures andensured documentation was updated‚Ä¢ Operated a range of laboratory equipment safely, evaluated and reportedtest results to managers, and recorded all test data in respect of chemicaladditions, purifications and dump cycles‚Ä¢ Tasked with maintaining, monitoring and updating the inventory of chemicalsand supplies‚Ä¢ Liaised with production department to ensure quality ‚Ä¢ Handled customer complaints‚Ä¢ Maintained products certification by getting them tested by externalcertification bodies such as BSTI and BUET\nEducation\nAiCore\nData Science/Machine Learning ¬∑ (2020 - 2021)\nThe University of Manchester\nPhD, Aerospace Materials ¬∑ (2007 - 2011)\nPage 4 of 5\nThe University of Manchester\nMSc, Advanced Engineering Materials ¬∑ (2006 - 2007)\nBangladesh University of Engineering and Technology\nBSc Engg., Materials and Metallurgical Engg. ¬∑ (1999 - 2004)\nPage 5 of 5",
      "parsed_at": "2025-06-10T02:39:08.480876",
      "file_path": "data\\cvs\\processed\\ee04360f1fe341d0973c_20250610_023908_151f2a3f_ee04360f1fe341d0973c1113ee0f51f6_Suraiyaa Zabeen.txt"
    },
    {
      "candidate_id": "b3d2f73737e140208eab_20250610_023823_216c865a",
      "file_name": "b3d2f73737e140208eab74c2b79d571f_Jack Townsend.txt",
      "full_name": "Jack Townsend",
      "contact_info": {
        "email": null,
        "phone": null,
        "location": "London, England, United Kingdom",
        "linkedin": "www.linkedin.com/in/jack-townsend-3b14a5163",
        "github": null
      },
      "summary": null,
      "skills": [
        "Artificial Intelligence (AI)",
        "PyTorch",
        "Cluster Analysis"
      ],
      "experience": [
        {
          "title": "Data Scientist",
          "company": "GEOLYTIX",
          "start_date": "04/2021",
          "end_date": "Present",
          "duration_months": 51,
          "description": null,
          "achievements": []
        },
        {
          "title": "Location Analyst",
          "company": "CACI Ltd",
          "start_date": "09/2017",
          "end_date": "04/2021",
          "duration_months": 44,
          "description": null,
          "achievements": []
        }
      ],
      "education": [
        {
          "degree": "Bachelor's degree",
          "institution": "University of Birmingham",
          "graduation_year": 2017,
          "gpa": null,
          "field_of_study": "Mathematics"
        }
      ],
      "certifications": [],
      "languages": [],
      "projects": [],
      "raw_text": "Contact\nwww.linkedin.com/in/jack-townsend-3b14a5163 (LinkedIn)\nTop Skills\nArtificial Intelligence (AI)\nPyTorch\nCluster Analysis\nJack Townsend\nData Scientist at GEOLYTIX\nLondon, England, United Kingdom\nExperience\nGEOLYTIX\nData Scientist\nApril 2021 - Present (4 years 3 months)\nLondon, England, United Kingdom\nCACI Ltd\nLocation Analyst\nSeptember 2017 - April 2021 (3 years 8 months)\nEducation\nUniversity of Birmingham\nBachelor's degree, Mathematics ¬∑ (2014 - 2017)\nPage 1 of 1",
      "parsed_at": "2025-06-10T02:38:23.366794",
      "file_path": "data\\cvs\\processed\\b3d2f73737e140208eab_20250610_023823_216c865a_b3d2f73737e140208eab74c2b79d571f_Jack Townsend.txt"
    },
    {
      "candidate_id": "7dc6edd695e440369a56_20250610_023849_5ba7cbb3",
      "file_name": "7dc6edd695e440369a560897fd1e8410_Neethu Muraleedharan.txt",
      "full_name": "Neethu Muraleedharan",
      "contact_info": {
        "email": null,
        "phone": null,
        "location": "London, England, United Kingdom",
        "linkedin": "www.linkedin.com/in/neethu-muraleedharan",
        "github": null
      },
      "summary": "Neethu is a passionate Data Scientist dedicated to unravelling the narratives hidden within data. With a Master's degree in Data Science from Lancaster University and proficiency in Python, SQL, and machine learning, she excels at merging data insights with strategic business goals. Throughout her career, Neethu has orchestrated complex data strategies, led stakeholder engagements, and developed automated dashboards to drive informed decisions. Her expertise spans regression, classification, clustering, and more, enabling her to uncover actionable patterns and trends that propel organisational success. Beyond her professional pursuits, she finds inspiration in music and art‚Äîsinging and drawing serve as her creative outlets. In all her endeavours, whether crafting predictive models or creating art, she brings creativity, curiosity, and a commitment to excellence.",
      "skills": [
        "Artificial Intelligence (AI)",
        "Text Mining",
        "Crystal Reports",
        "Python",
        "SQL",
        "Machine Learning",
        "Regression",
        "Classification",
        "Clustering",
        "Data Analysis",
        "Predictive Modelling",
        "Data Visualization",
        "Power BI",
        "Google Analytics",
        "Meta Business Suite",
        "SEO",
        "Dashboard Development",
        "Stakeholder Engagement"
      ],
      "experience": [
        {
          "title": "Data Scientist",
          "company": "Career Connect",
          "start_date": "07/2023",
          "end_date": "12/2024",
          "duration_months": 18,
          "description": "At Career Connect, I focus on analyzing data to develop predictive models that assess the risk of young individuals becoming NEET (Not in Education, Employment, or Training). By examining historical trends and key factors such as demographics, education, and socio-economic conditions, I identify patterns that inform early intervention strategies to reduce NEET rates and promote youth engagement. My role involves collaborating with teams to collect and refine data, ensuring that analyses are accurate and actionable. The insights I generate support evidence-based policy-making and program design. Additionally, I streamline reporting processes, build dashboards, and provide strategic insights to advance Career Connect's mission. Through data-driven analytics, I aim to enhance educational, employment, and training outcomes, helping young people achieve long-term success.",
          "achievements": [
            "Developed predictive models to assess NEET risk",
            "Streamlined reporting processes",
            "Built dashboards for strategic insights",
            "Supported evidence-based policy-making"
          ]
        },
        {
          "title": "Data Science Intern",
          "company": "Lancashire County Council",
          "start_date": "06/2022",
          "end_date": "09/2022",
          "duration_months": 4,
          "description": "I've played a pivotal role in revolutionising healthcare services through data-driven insights and innovative solutions. From aggregating and structuring complex datasets to developing predictive models for attendance forecasting, my journey as a Data Science Intern at LCC has been marked by a relentless pursuit of efficiency and excellence. Leveraging advanced analytics tools like Python and Power BI, I've unearthed actionable insights that have not only optimised NHS health check services but also empowered decision-makers with invaluable information. My collaborative spirit and effective communication have fostered a dynamic team environment, where sharing insights and ideas is paramount to success. My passion for making a tangible impact in healthcare, combined with a diverse skill set encompassing data analysis, predictive modelling, and visualisation, continues to drive me towards shaping a brighter future for healthcare delivery.",
          "achievements": [
            "Developed predictive models for attendance forecasting",
            "Optimised NHS health check services",
            "Aggregated and structured complex healthcare datasets"
          ]
        },
        {
          "title": "Business Analyst",
          "company": "Evoke Frames By Sarath Santhan",
          "start_date": "01/2019",
          "end_date": "10/2021",
          "duration_months": 34,
          "description": "My role at Evoke Frames encompasses a diverse array of responsibilities crucial to the company's growth and client acquisition. Key highlights include building strong client relationships, developing sales and marketing strategies, identifying and mitigating business risks, and utilising data insights for informed decision-making. By leveraging tools like Google Analytics and Meta Business Suite, I've spearheaded web analysis and implemented SEO-focused content strategies, resulting in significant reductions in bounce rates and notable sales increases. My multifaceted contributions at the intersection of client relations, data analysis, and strategic decision-making have been instrumental in elevating Evoke Frame's market presence and driving substantial growth.",
          "achievements": [
            "Implemented SEO-focused content strategies",
            "Achieved significant reductions in bounce rates",
            "Drove notable sales increases",
            "Built strong client relationships"
          ]
        },
        {
          "title": "IT Engineer",
          "company": "Wipro Technologies",
          "start_date": "01/2015",
          "end_date": "10/2015",
          "duration_months": 10,
          "description": null,
          "achievements": []
        },
        {
          "title": "Trainee",
          "company": "Wipro Technologies",
          "start_date": "10/2014",
          "end_date": "12/2014",
          "duration_months": 3,
          "description": null,
          "achievements": []
        }
      ],
      "education": [
        {
          "degree": "Master's degree",
          "institution": "Lancaster University",
          "graduation_year": 2022,
          "gpa": null,
          "field_of_study": "Data Science"
        },
        {
          "degree": "Master of Science - MSc",
          "institution": "Pillai College of Arts,Commerce and Science",
          "graduation_year": 2018,
          "gpa": null,
          "field_of_study": "Information Technology"
        },
        {
          "degree": "Bachelor of Science - BSc",
          "institution": "Pillai College of Arts,Commerce and Science",
          "graduation_year": 2014,
          "gpa": null,
          "field_of_study": "Information Technology"
        }
      ],
      "certifications": [
        "IBM Data Science Professional Certificate",
        "Data Visualization with Python",
        "Tools for Data Science",
        "Data Analysis with Python"
      ],
      "languages": [],
      "projects": [],
      "raw_text": "Contact\nwww.linkedin.com/in/neethu-muraleedharan (LinkedIn)\nTop Skills\nArtificial Intelligence (AI)\nText Mining\nCrystal Reports\nCertifications\nIBM Data Science ProfessionalCertificate\nData Visualization with Python\nTools for Data Science\nData Analysis with Python\nIBM Data Science ProfessionalCertificate\nNeethu Muraleedharan\nData Scientist | Predictive Modelling and AI Solutions\nLondon, England, United Kingdom\nSummary\nNeethu is a passionate Data Scientist dedicated to unravellingthe narratives hidden within data. With a Master's degree in DataScience from Lancaster University and proficiency in Python, SQL,and machine learning, she excels at merging data insights withstrategic business goals.Throughout her career, Neethu has orchestrated complex datastrategies, led stakeholder engagements, and developed automateddashboards to drive informed decisions. Her expertise spansregression, classification, clustering, and more, enabling her touncover actionable patterns and trends that propel organisationalsuccess.Beyond her professional pursuits, she finds inspiration in music andart‚Äîsinging and drawing serve as her creative outlets.In all her endeavours, whether crafting predictive models or creatingart, she brings creativity, curiosity, and a commitment to excellence.\nExperience\nCareer Connect\nData Scientist\nJuly 2023 - December 2024 (1 year 6 months)\nLiverpool, England, United Kingdom\nAt Career Connect, I focus on analyzing data to develop predictive modelsthat assess the risk of young individuals becoming NEET (Not in Education,Employment, or Training). By examining historical trends and key factors suchas demographics, education, and socio-economic conditions, I identify patternsthat inform early intervention strategies to reduce NEET rates and promoteyouth engagement.\nPage 1 of 3\nMy role involves collaborating with teams to collect and refine data, ensuringthat analyses are accurate and actionable. The insights I generate supportevidence-based policy-making and program design. Additionally, I streamlinereporting processes, build dashboards, and provide strategic insights toadvance Career Connect's mission. Through data-driven analytics, I aim toenhance educational, employment, and training outcomes, helping youngpeople achieve long-term success.\nLancashire County Council\nData Science Intern\nJune 2022 - September 2022 (4 months)\nPreston, England, United Kingdom\nI've played a pivotal role in revolutionising healthcare services through data-driven insights and innovative solutions. From aggregating and structuringcomplex datasets to developing predictive models for attendance forecasting,my journey as a Data Science Intern at LCC has been marked by a relentlesspursuit of efficiency and excellence. Leveraging advanced analytics tools likePython and Power BI, I've unearthed actionable insights that have not onlyoptimised NHS health check services but also empowered decision-makerswith invaluable information. My collaborative spirit and effective communicationhave fostered a dynamic team environment, where sharing insights andideas is paramount to success. My passion for making a tangible impact inhealthcare, combined with a diverse skill set encompassing data analysis,predictive modelling, and visualisation, continues to drive me towards shapinga brighter future for healthcare delivery.\nEvoke Frames By Sarath Santhan\nBusiness Analyst\nJanuary 2019 - October 2021 (2 years 10 months)\nMumbai, Maharashtra, India\nMy role at Evoke Frames encompasses a diverse array of responsibilitiescrucial to the company's growth and client acquisition. Key highlights includebuilding strong client relationships, developing sales and marketing strategies,identifying and mitigating business risks, and utilising data insights for informeddecision-making. By leveraging tools like Google Analytics and Meta BusinessSuite, I've spearheaded web analysis and implemented SEO-focused contentstrategies, resulting in significant reductions in bounce rates and notablesales increases. My multifaceted contributions at the intersection of clientrelations, data analysis, and strategic decision-making have been instrumentalin elevating Evoke Frame's market presence and driving substantial growth.\nPage 2 of 3\nWipro Technologies\n1 year 1 month\nIT Engineer\nJanuary 2015 - October 2015 (10 months)\nMumbai, Maharashtra, India\nTrainee\nOctober 2014 - December 2014 (3 months)\nMumbai, Maharashtra, India\nEducation\nLancaster University\nMaster's degree, Data Science ¬∑ (October 2021 - September 2022)\nPillai College of Arts,Commerce and Science\nMaster of Science - MSc, Information Technology ¬∑ (July 2016 - June 2018)\nPillai College of Arts,Commerce and Science\nBachelor of Science - BSc, Information Technology ¬∑ (April 2011 - March 2014)\nPage 3 of 3",
      "parsed_at": "2025-06-10T02:38:49.697496",
      "file_path": "data\\cvs\\processed\\7dc6edd695e440369a56_20250610_023849_5ba7cbb3_7dc6edd695e440369a560897fd1e8410_Neethu Muraleedharan.txt"
    },
    {
      "candidate_id": "95615a2a092f4fdd9a80_20250610_023827_2bbcf2fe",
      "file_name": "95615a2a092f4fdd9a80837893825521_Taiyu Xie.txt",
      "full_name": "Taiyu Xie",
      "contact_info": {
        "email": null,
        "phone": null,
        "location": "London, England, United Kingdom",
        "linkedin": "www.linkedin.com/in/taiyu-xie-cqf-608648170",
        "github": null
      },
      "summary": null,
      "skills": [
        "Quantitative Finance",
        "Quantitative Research",
        "Derivatives",
        "Data Science"
      ],
      "experience": [
        {
          "title": "Data science Consultant",
          "company": "Accenture",
          "start_date": "11/2021",
          "end_date": "Present",
          "duration_months": 44,
          "description": null,
          "achievements": []
        },
        {
          "title": "COO & Co-Founder",
          "company": "Siotech LTD",
          "start_date": "10/2019",
          "end_date": "10/2021",
          "duration_months": 24,
          "description": null,
          "achievements": []
        },
        {
          "title": "Data Science Intern",
          "company": "China Mobile IoT Company Limited",
          "start_date": "07/2018",
          "end_date": "08/2018",
          "duration_months": 2,
          "description": null,
          "achievements": []
        },
        {
          "title": "Summer Intern",
          "company": "Zhongtai Financial International Limited",
          "start_date": "06/2017",
          "end_date": "09/2017",
          "duration_months": 4,
          "description": null,
          "achievements": []
        },
        {
          "title": "Technology consultant Intern",
          "company": "Bank of China",
          "start_date": "06/2016",
          "end_date": "08/2016",
          "duration_months": 3,
          "description": null,
          "achievements": []
        }
      ],
      "education": [
        {
          "degree": "Postgraduate",
          "institution": "King's College London",
          "graduation_year": 2019,
          "gpa": null,
          "field_of_study": "Data science"
        },
        {
          "degree": "Bachelor of Science - BS",
          "institution": "UCL",
          "graduation_year": 2018,
          "gpa": null,
          "field_of_study": "Mathematics"
        }
      ],
      "certifications": [
        "AWS Certified Cloud Practitioner",
        "Computational Methods in Pricing and Model Calibration",
        "Certificate in Quantitative Finance",
        "Optimization Methods in Asset Management"
      ],
      "languages": [
        "English (Professional Working)",
        "Chinese (Native or Bilingual)"
      ],
      "projects": [],
      "raw_text": "Contact\nwww.linkedin.com/in/taiyu-xie-cqf-608648170 (LinkedIn)\nTop Skills\nQuantitative Finance\nQuantitative Research\nDerivatives\nLanguages\nEnglish (Professional Working)\nChinese (Native or Bilingual)\nCertifications\nAWS Certified Cloud Practitioner\nComputational Methods in Pricingand Model Calibration\nCertificate in Quantitative Finance\nOptimization Methods in AssetManagement\nTaiyu Xie, CQF\nData Scientist\nLondon, England, United Kingdom\nExperience\nAccenture\nData science Consultant\nNovember 2021 - Present (3 years 8 months)\nLondon Area, United Kingdom\nSiotech LTD\nCOO & Co-Founder\nOctober 2019 - October 2021 (2 years 1 month)\nLondon, United Kingdom\nChina Mobile IoT Company Limited\nData Science Intern\nJuly 2018 - August 2018 (2 months)\nJinan, Shandong, China\nZhongtai Financial International Limited\nSummer Intern\nJune 2017 - September 2017 (4 months)\nQingdao, Shandong, China\nBank of China\nTechnology consultant Intern\nJune 2016 - August 2016 (3 months)\nQingdao, Shandong, China\nEducation\nKing's College London\nPostgraduate, Data science ¬∑ (2018 - 2019)\nUCL\nBachelor of Science - BS, Mathematics ¬∑ (2015 - 2018)\nPage 1 of 1",
      "parsed_at": "2025-06-10T02:38:27.607305",
      "file_path": "data\\cvs\\processed\\95615a2a092f4fdd9a80_20250610_023827_2bbcf2fe_95615a2a092f4fdd9a80837893825521_Taiyu Xie.txt"
    },
    {
      "candidate_id": "92372e2388fb441e956b_20250610_023915_d4b5335f",
      "file_name": "92372e2388fb441e956bd8cbb894f275_G√ºl √áetin.txt",
      "full_name": "G√ºl √áetin",
      "contact_info": {
        "email": null,
        "phone": null,
        "location": "Londra, ƒ∞ngiltere, Birle≈üik Krallƒ±k",
        "linkedin": "www.linkedin.com/in/gul-cetin",
        "github": null
      },
      "summary": "A lifelong learner interested in sustainability, technology and art",
      "skills": [
        "Data Science",
        "Programming",
        "Python (Programming Language)",
        "SQL",
        "Excel",
        "R",
        "Time series analysis",
        "Statistical analysis",
        "Regression modelling",
        "Logistic regression",
        "NLP models",
        "Transformer-based models",
        "Data pipelines",
        "Data preprocessing",
        "Data analysis",
        "ESG data"
      ],
      "experience": [
        {
          "title": "Data Scientist",
          "company": "apiday",
          "start_date": "09/2023",
          "end_date": "Present",
          "duration_months": 22,
          "description": "Engineered and maintained scalable ESG data pipelines using Python and SQL, automating the collection, processing, and integration of structured and unstructured data. Revamped ESG questionnaire-matching algorithms through transformer-based NLP models.",
          "achievements": [
            "Reduced manual workload by over 200 hours annually",
            "Accelerated data delivery timelines by 35%",
            "Improved matching accuracy by 30%",
            "Enhanced ESG metric classification at the portfolio level"
          ]
        },
        {
          "title": "Scholarship Holder",
          "company": "Jean Monnet Burs Programƒ± / Jean Monnet Scholarship Programme",
          "start_date": "09/2022",
          "end_date": "10/2023",
          "duration_months": 14,
          "description": "Within the scope of the Scholarship Program, as one of Turkey's longest and most prestigious project, selected scholars are granted the right to do research or postgraduate studies in a university in the EU member countries and the UK.",
          "achievements": []
        },
        {
          "title": "Business Analyst",
          "company": "Rebos",
          "start_date": "08/2022",
          "end_date": "12/2022",
          "duration_months": 5,
          "description": "Optimised inventory levels using time series analysis. Led a data-driven revenue initiative employing Python-based statistical analysis and regression modelling to identify key purchasing behaviour drivers over one year.",
          "achievements": [
            "12% reduction in stockouts",
            "Increased customer footfall by 5%"
          ]
        },
        {
          "title": "Program Analyst",
          "company": "inzva",
          "start_date": "07/2020",
          "end_date": "07/2022",
          "duration_months": 25,
          "description": "Managed 16 fully-funded projects, programmes, and educational events focused on algorithms. Spearheaded the systematic collection and comprehensive analysis of educational programme data, utilising Python for data processing and applying logistic regression to identify key factors influencing student retention.",
          "achievements": [
            "Engaged over 1,500 participants",
            "Achieved a 25% increase in student retention",
            "20% improvement in graduation rates over two academic years",
            "Increased participant satisfaction by 18%"
          ]
        },
        {
          "title": "Project Developer",
          "company": "Cameroon Association of Active Youths (CAMAAY)",
          "start_date": "08/2019",
          "end_date": "07/2020",
          "duration_months": 12,
          "description": "Developed the \"Better Street Lighting for Better Livelihoods\" project proposal, raising ‚Ç¨2,000 to install 20 solar street lamps in Cameroon. This initiative tackled security issues stemming from inoperative lighting systems and created employment opportunities for seven local youths.",
          "achievements": [
            "Raised ‚Ç¨2,000 for project implementation",
            "Installed 20 solar street lamps",
            "Created employment opportunities for 7 local youths"
          ]
        },
        {
          "title": "Research Assistant",
          "company": "TUBITAK",
          "start_date": "01/2020",
          "end_date": "03/2020",
          "duration_months": 3,
          "description": "Conducted data preprocessing and analysis for the discussion paper \"Regional Inequalities and the West-East Divide in Turkey\" using Excel and R on a large dataset spanning 1913‚Äì1991.",
          "achievements": []
        },
        {
          "title": "Undergraduate Teaching Assistant",
          "company": "Boƒüazi√ßi University",
          "start_date": "09/2019",
          "end_date": "12/2019",
          "duration_months": 4,
          "description": "EC101 Principles of Microeconomics",
          "achievements": []
        }
      ],
      "education": [
        {
          "degree": "MSc",
          "institution": "The London School of Economics and Political Science (LSE)",
          "graduation_year": 2023,
          "gpa": null,
          "field_of_study": "Development Studies"
        },
        {
          "degree": "Bachelor's",
          "institution": "Bogazici University Department of Economics",
          "graduation_year": 2020,
          "gpa": null,
          "field_of_study": "Economics"
        },
        {
          "degree": "Exchange",
          "institution": "Ghent University",
          "graduation_year": 2019,
          "gpa": null,
          "field_of_study": "Economics"
        }
      ],
      "certifications": [
        "CS50: Introduction to Computer Science",
        "Scientific Computing with Python",
        "Excel Skills for Business: Intermediate I",
        "CS50's Web Programming with Python and JavaScript",
        "Excel Skills for Business: Intermediate II"
      ],
      "languages": [
        "Turkish (Native or Bilingual)",
        "English (Professional Working)",
        "French (Elementary)"
      ],
      "projects": [
        "Better Street Lighting for Better Livelihoods",
        "Regional Inequalities and the West-East Divide in Turkey"
      ],
      "raw_text": "ƒ∞leti≈üim Bilgileri\nwww.linkedin.com/in/gul-cetin(LinkedIn)\nEn √ñnemli Yetenekler\nData Science\nProgramming\nPython (Programming Language)\nLanguages\nFrench (Elementary)\nEnglish (Professional Working)\nTurkish (Native or Bilingual)\nCertifications\nCS50: Introduction to ComputerScience\nScientific Computing with Python\nExcel Skills for Business:Intermediate I\nCS50's Web Programming withPython and JavaScript\nExcel Skills for Business:Intermediate II\nG√ºl √áetin\nData Scientist\nLondra, ƒ∞ngiltere, Birle≈üik Krallƒ±k\n√ñzet\nA lifelong learner interested in sustainability, technology and art\nDeneyim\napiday\nData Scientist\nEyl√ºl 2023 - Present (1 yƒ±l 10 ay)\nLondon Area, United Kingdom\n- Engineered and maintained scalable ESG data pipelines using Python andSQL, automating the collection, processing, and integration of structured andunstructured data. Reduced manual workload by over 200 hours annually andaccelerated data delivery timelines by 35%.- Revamped ESG questionnaire-matching algorithms through transformer-based NLP models, improving matching accuracy by 30% and enhancing ESGmetric classification at the portfolio level.\nJean Monnet Burs Programƒ± / Jean Monnet Scholarship Programme\nScholarship Holder\nEyl√ºl 2022 - Ekim 2023 (1 yƒ±l 2 ay)\nLondon, England, United Kingdom\nWithin the scope of the Scholarship Program, as one of Turkey‚Äôs longest andmost prestigious project, selected scholars are granted the right to do researchor postgraduate studies in a university in the EU member countries and theUK.\nRebos\nBusiness Analyst\nAƒüustos 2022 - Aralƒ±k 2022 (5 ay)\nLondon, England, United Kingdom\n- Optimised inventory levels using time series analysis, resulting in a 12%reduction in stockouts.- Led a data-driven revenue initiative that increased customer footfall by 5%,employing Python-based statistical analysis and regression modelling toidentify key purchasing behaviour drivers over one year.\nPage 1 of 3\ninzva\nProgram Analyst\nTemmuz 2020 - Temmuz 2022 (2 yƒ±l 1 ay)\n- Managed 16 fully-funded projects, programmes, and educational eventsfocused on algorithms, engaging over 1,500 participants and streamlining thelearning experience.- Spearheaded the systematic collection and comprehensive analysis ofeducational programme data, utilising Python for data processing andapplying logistic regression to identify key factors influencing student retention,achieving a 25% increase in student retention and a 20% improvement ingraduation rates over two academic years.- Introduced innovative solutions, including hackathons and peer reviewsessions, aligned with best practices, increasing participant satisfaction by18% and enhancing skill development.\nCameroon Association of Active Youths (CAMAAY)\nProject Developer\nAƒüustos 2019 - Temmuz 2020 (1 yƒ±l)\n- Developed the ‚ÄúBetter Street Lighting for Better Livelihoods‚Äù project proposal,raising ‚Ç¨2,000 to install 20 solar street lamps in Cameroon. This initiativetackled security issues stemming from inoperative lighting systems andcreated employment opportunities for seven local youths.\nTUBITAK\nResearch Assistant\nOcak 2020 - Mart 2020 (3 ay)\n- Conducted data preprocessing and analysis for the discussion paper‚ÄúRegional Inequalities and the West-East Divide in Turkey‚Äù using Excel and Ron a large dataset spanning 1913‚Äì1991.\nBoƒüazi√ßi University\nUndergraduate Teaching Assistant\nEyl√ºl 2019 - Aralƒ±k 2019 (4 ay)\nEC101 Principles of Microeconomics\nEƒüitim\nThe London School of Economics and Political Science (LSE)\nMSc, Development Studies ¬∑ (Eyl√ºl 2022 - Eyl√ºl 2023)\nPage 2 of 3\nBogazici University Department of Economics\nEconomics ¬∑ (2015 - 2020)\nGhent University\nExchange, Economics ¬∑ (2019 - 2019)\nPage 3 of 3",
      "parsed_at": "2025-06-10T02:39:15.873987",
      "file_path": "data\\cvs\\processed\\92372e2388fb441e956b_20250610_023915_d4b5335f_92372e2388fb441e956bd8cbb894f275_G√ºl √áetin.txt"
    },
    {
      "candidate_id": "942d9124626d46a3a447_20250610_023824_f2b4250c",
      "file_name": "942d9124626d46a3a447ba664b20397b_Sahil Hussain.txt",
      "full_name": "Sahil Hussain",
      "contact_info": {
        "email": null,
        "phone": null,
        "location": "London, England, United Kingdom",
        "linkedin": "www.linkedin.com/in/sahil-hussain-992b1b261",
        "github": null
      },
      "summary": null,
      "skills": [
        "Snowflake",
        "Microsoft Azure",
        "Data Warehouse Architecture"
      ],
      "experience": [
        {
          "title": "Data Scientist",
          "company": "Ishka: Aviation Finance",
          "start_date": "02/2024",
          "end_date": "01/2025",
          "duration_months": 12,
          "description": null,
          "achievements": null
        },
        {
          "title": "Data Analyst",
          "company": "Vodafone",
          "start_date": "05/2023",
          "end_date": "02/2024",
          "duration_months": 10,
          "description": null,
          "achievements": null
        },
        {
          "title": "Data Analyst Apprentice",
          "company": "Vodafone",
          "start_date": "09/2020",
          "end_date": "05/2023",
          "duration_months": 33,
          "description": null,
          "achievements": null
        }
      ],
      "education": [
        {
          "degree": "Bachelor of Science - BSc",
          "institution": "Lancaster University",
          "graduation_year": 2023,
          "gpa": null,
          "field_of_study": "Data Science"
        },
        {
          "degree": "Bachelor of Science - BSc",
          "institution": "University of Greenwich",
          "graduation_year": 2020,
          "gpa": null,
          "field_of_study": "Psychology"
        }
      ],
      "certifications": [],
      "languages": [
        "English (Native or Bilingual)",
        "Bengali (Native or Bilingual)",
        "Spanish (Professional Working)",
        "Urdu (Limited Working)"
      ],
      "projects": [],
      "raw_text": "Contact\nwww.linkedin.com/in/sahil-hussain-992b1b261 (LinkedIn)\nTop Skills\nSnowflake\nMicrosoft Azure\nData Warehouse Architecture\nLanguages\nEnglish (Native or Bilingual)\nBengali (Native or Bilingual)\nSpanish (Professional Working)\nUrdu (Limited Working)\nSahil Hussain\nData Scientist\nLondon, England, United Kingdom\nExperience\nIshka: Aviation Finance\nData Scientist\nFebruary 2024 - January 2025 (1 year)\nCity Of London, England, United Kingdom\nVodafone\n3 years 6 months\nData Analyst\nMay 2023 - February 2024 (10 months)\nLondon, England, United Kingdom\nData Analyst Apprentice\nSeptember 2020 - May 2023 (2 years 9 months)\nEducation\nLancaster University\nBachelor of Science - BSc, Data Science ¬∑ (September 2020 - May 2023)\nUniversity of Greenwich\nBachelor of Science - BSc, Psychology ¬∑ (September 2017 - May 2020)\nPage 1 of 1",
      "parsed_at": "2025-06-10T02:38:24.708654",
      "file_path": "data\\cvs\\processed\\942d9124626d46a3a447_20250610_023824_f2b4250c_942d9124626d46a3a447ba664b20397b_Sahil Hussain.txt"
    },
    {
      "candidate_id": "99cd4f83d50d4245ba92_20250610_023847_daa608aa",
      "file_name": "99cd4f83d50d4245ba92351c5ed7b469_Sharaf M.txt",
      "full_name": "Sharaf M.",
      "contact_info": {
        "email": null,
        "phone": null,
        "location": "London, England, United Kingdom",
        "linkedin": "www.linkedin.com/in/sharaf-momen-632886i",
        "github": null
      },
      "summary": null,
      "skills": [
        "GitHub",
        "ETL Tools",
        "Data Modeling",
        "AB testing",
        "Airflow",
        "Redshift",
        "QuickSight",
        "PySpark",
        "PostgreSQL",
        "Machine Learning",
        "CNN",
        "API development",
        "SQL",
        "Web scraping",
        "AWS Lambda",
        "Topic modelling",
        "Sentiment analysis",
        "Data pipelines",
        "Dashboard development"
      ],
      "experience": [
        {
          "title": "Data Scientist",
          "company": "Muzz",
          "start_date": "05/2023",
          "end_date": "07/2024",
          "duration_months": 15,
          "description": "Work with AB testing/experiments for revenue and retention. Build and maintain dashboards to monitor revenue metrics and feature post-release analysis. Built an API that allows the data science team to personalise upsells to users. Update ELT pipelines regularly on Airflow. Segmentation tasks to personalise how we target and better help users. Work closely with data science team, and regularly conduct reviews of PRs and code for ETL pipelines, APIs, and SQL analysis.",
          "achievements": [
            "Built an API for personalised upsells",
            "Maintained revenue monitoring dashboards",
            "Conducted AB testing for revenue and retention optimization"
          ]
        },
        {
          "title": "Data Scientist",
          "company": "permutable.ai",
          "start_date": "08/2022",
          "end_date": "02/2023",
          "duration_months": 7,
          "description": "Built end-to-end data pipeline for the collection and sentiment analysis of tweets with Airflow and Redshift. Developed and managed QuickSight dashboards for clients to track the ESG profile of their supply chain. Worked on a project to source news in multiple languages asynchronously, as part of a larger Airflow DAG. Developed and deployed a web scraper through AWS Lambda to retrieve information to enhance brand SEO. Worked on data product demos with clients, engaged in product design, kept record of pain points from client feedback. Exposed to application of topic modelling to address relevant clusters that exist among all news articles collected.",
          "achievements": [
            "Built end-to-end data pipeline for tweet sentiment analysis",
            "Developed QuickSight dashboards for ESG tracking",
            "Deployed web scraper through AWS Lambda",
            "Implemented topic modelling for news article clustering"
          ]
        },
        {
          "title": "Data Scientist",
          "company": "Honest AI",
          "start_date": "04/2022",
          "end_date": "08/2022",
          "duration_months": 5,
          "description": "Integrated and tested third-party real estate APIs with existing data sources. Developed ETL pipeline using PySpark for PostgreSQL storage. Analysed and delivered insights from newly ingested real estate data in the UK. Incorporated explainability practices on Machine Learning algorithms for exploratory data analysis purposes. Developed a hybrid multi-input model that predicts house prices using a CNN embedding of neighbourhoods.",
          "achievements": [
            "Developed ETL pipeline using PySpark",
            "Created hybrid multi-input model for house price prediction",
            "Integrated third-party real estate APIs",
            "Implemented ML explainability practices"
          ]
        },
        {
          "title": "Junior Achievement Company Programme: CEO of Mindful Mugs",
          "company": "Junior Achievement Singapore",
          "start_date": "07/2016",
          "end_date": "01/2017",
          "duration_months": 7,
          "description": "As a CEO, ran a company under the annual Singapore Company Challenge, hosted by the Junior Achievement. Different Polytechnics, Junior Colleges and High Schools had to compete through having the best performing company, taking into consideration the processes undergone and the quality/accuracy of company literature. Ultimately, my company won 2nd place in Singapore, equipping me with the following corporate skills: Critical problem-solving, Financial Planning and Literature, Market planning, research and strategy, Supply-chain management, Remuneration strategies and negotiation, Public Relations and stakeholder management",
          "achievements": [
            "Won 2nd place in Singapore Company Challenge",
            "Led company as CEO in competitive business challenge"
          ]
        }
      ],
      "education": [
        {
          "degree": "Master of Science - MS",
          "institution": "UCL",
          "graduation_year": 2022,
          "gpa": null,
          "field_of_study": "Business Analytics"
        },
        {
          "degree": "Bachelor of Science - BS",
          "institution": "University of Warwick",
          "graduation_year": 2021,
          "gpa": null,
          "field_of_study": "International Management"
        },
        {
          "degree": "Year Abroad",
          "institution": "Schulich School of Business - York University",
          "graduation_year": 2019,
          "gpa": null,
          "field_of_study": "Business Administration and Management, General"
        },
        {
          "degree": "International Baccalaureate",
          "institution": "International School of Singapore",
          "graduation_year": 2017,
          "gpa": null,
          "field_of_study": null
        },
        {
          "degree": "Pre-diploma Level",
          "institution": "ABRSM",
          "graduation_year": 2016,
          "gpa": null,
          "field_of_study": "Music Theory and Piano Practical"
        }
      ],
      "certifications": [],
      "languages": [],
      "projects": [
        "API for personalised upsells",
        "Tweet sentiment analysis pipeline",
        "ESG profile tracking dashboards",
        "Multi-language news sourcing system",
        "Web scraper for brand SEO",
        "Hybrid multi-input house price prediction model",
        "Mindful Mugs company (Junior Achievement)"
      ],
      "raw_text": "Contact\nwww.linkedin.com/in/sharaf-momen-632886i (LinkedIn)\nTop Skills\nGitHub\nETL Tools\nData Modeling\nSharaf M.\nData Scientist\nLondon, England, United Kingdom\nExperience\nMuzz\nData Scientist\nMay 2023 - July 2024 (1 year 3 months)\nCity Of London, England, United Kingdom\nI work with AB testing/experiments for revenue and retention. I build and maintain dashboards to monitor revenue metrics and feature post-release analysis.I built an API that allows the data science team to personalise upsells tousers. I also update ELT pipelines regularly on Airflow.There have been segmentation tasks that I helped with to personalise how wetarget and better help users. Work closely with data science team, and regularly conduct reviews of PRsand code for ETL pipelines, APIs, and SQL analysis.\npermutable.ai\nData Scientist\nAugust 2022 - February 2023 (7 months)\nLondon, England, United Kingdom\nBuilt end-to-end data pipeline for the collection and sentiment analysis oftweets with Airflow and Redshift.Developed and managed QuickSight dashboards for clients to track the ESGprofile of their supply chain. Worked on a project to source news in multiple languages asynchronously, aspart of a larger Airflow DAG. Developed and deployed a web scraper through AWS Lambda to retrieveinformation to enhance brand SEO. Worked on data product demos with clients, engaged in product design, keptrecord of pain points from client feedback.\nPage 1 of 3\nExposed to application of topic modelling to address relevant clusters that existamong all news articles collected.\nHonest AI\nData Scientist\nApril 2022 - August 2022 (5 months)\nLondon, England, United Kingdom\nIntegrated and tested third-party real estate APIs with existing data sources.Developed ETL pipeline using PySpark for PostgreSQL storage. Analysed and delivered insights from newly ingested real estate data in theUK. Incorporated explainability practices on Machine Learning algorithms forexploratory data analysis purposes.Developed a hybrid multi-input model that predicts house prices using a CNNembedding of neighbourhoods.\nJunior Achievement Singapore\nJunior Achievement Company Programme: CEO of Mindful Mugs\nJuly 2016 - January 2017 (7 months)\nSingapore\nAs a CEO, I ran a company under the annual Singapore Company Challenge,hosted by the Junior Achievement. Different Polytechnics, Junior Colleges andHigh Schools had to compete through having the best performing company,taking into consideration the processes undergone and the quality/accuracy ofcompany literature. Ultimately, my company won 2nd place in Singapore, equipping me with thefollowing corporate skills:- Critical problem-solving- Financial Planning and Literature- Market planning, research and strategy- Supply-chain management- Remuneration strategies and negotiation- Public Relations and stakeholder management\nEducation\nUCL\nMaster of Science - MS, Business Analytics ¬∑ (September 2021 - June 2022)\nPage 2 of 3\nUniversity of Warwick\nBachelor of Science - BS, International Management ¬∑ (2017 - 2021)\nSchulich School of Business - York University\nYear Abroad, Business Administration and Management,General ¬∑ (2019 - 2019)\nInternational School of Singapore\nInternational Baccalaureate ¬∑ (2015 - 2017)\nABRSM\nPre-diploma Level, Music Theory and Piano Practical ¬∑ (September2012 - June 2016)\nPage 3 of 3",
      "parsed_at": "2025-06-10T02:38:47.018561",
      "file_path": "data\\cvs\\processed\\99cd4f83d50d4245ba92_20250610_023847_daa608aa_99cd4f83d50d4245ba92351c5ed7b469_Sharaf M.txt"
    },
    {
      "candidate_id": "067b812f2a3744e1a5cb_20250610_023833_1c15f364",
      "file_name": "067b812f2a3744e1a5cb4e1e21a75ca4_Siddhesh Sathe.txt",
      "full_name": "Siddhesh Sathe",
      "contact_info": {
        "email": null,
        "phone": null,
        "location": "London Area, United Kingdom",
        "linkedin": "www.linkedin.com/in/thesidsat",
        "github": null
      },
      "summary": "I have effectively assisted clients worldwide in meeting their business and technical objectives through implementation of data science solutions. My expertise is in leveraging artificial intelligence, and I hold a Master's degree in Computer Science with specialization in AI from University of Leeds. Currently, I am applying my skills and knowledge as a member of the TradeTeq team, actively contributing to the company's success.",
      "skills": [
        "Langchain",
        "Programming",
        "Data Mining",
        "Artificial Intelligence",
        "Data Science",
        "Machine Learning",
        "Computer Vision",
        "NLP",
        "ANNs",
        "LSTMs",
        "YOLO",
        "Predictive Modelling",
        "Risk Management",
        "Docker",
        "RESTful APIs",
        "FX Trading",
        "Oracle Development"
      ],
      "experience": [
        {
          "title": "Data Scientist",
          "company": "Tradeteq",
          "start_date": "05/2022",
          "end_date": "03/2025",
          "duration_months": 35,
          "description": "London, England, United Kingdom",
          "achievements": []
        },
        {
          "title": "Artificial Intelligence Engineer",
          "company": "Redev Ltd",
          "start_date": "11/2020",
          "end_date": "05/2022",
          "duration_months": 19,
          "description": "Leeds, England, United Kingdom",
          "achievements": [
            "Actively managed core trading strategies across FX and indices",
            "Designed, developed and backtested Risk Management and profit taking capabilities resulting in higher Alpha",
            "Established dockerised AI modules with RESTful APIs to streamline transition from prototyping to deployment",
            "Designed ANNs and LSTMs in predictive modelling",
            "Extended YOLO to detect fraud from CCTV feed in a resource constrained environment"
          ]
        },
        {
          "title": "Analytics Consultant",
          "company": "Redev Ltd",
          "start_date": "01/2020",
          "end_date": "10/2020",
          "duration_months": 10,
          "description": "Leeds, United Kingdom",
          "achievements": []
        },
        {
          "title": "Freelance Data Scientist",
          "company": "Upwork",
          "start_date": "06/2017",
          "end_date": "09/2019",
          "duration_months": 28,
          "description": "Former Top Rated freelancer - Top 10% of freelancers on the platform",
          "achievements": [
            "Worked on delivering end to end data science solutions to 20+ clients across industries in computer vision, NLP and machine learning"
          ]
        },
        {
          "title": "Winter Intern",
          "company": "Aalborg Universitet",
          "start_date": "12/2016",
          "end_date": "12/2016",
          "duration_months": 1,
          "description": "Copenhagen Area, Denmark",
          "achievements": []
        },
        {
          "title": "Intern(Oracle Dev)",
          "company": "Forbes Marshall",
          "start_date": "06/2016",
          "end_date": "06/2016",
          "duration_months": 1,
          "description": null,
          "achievements": []
        }
      ],
      "education": [
        {
          "degree": "MSc. Advanced Computer Science",
          "institution": "University of Leeds",
          "graduation_year": 2020,
          "gpa": null,
          "field_of_study": "Artificial Intelligence"
        },
        {
          "degree": "Bachelor of Engineering (B.E.)",
          "institution": "University of Pune",
          "graduation_year": 2017,
          "gpa": null,
          "field_of_study": "Computer Science"
        }
      ],
      "certifications": [
        "AMCAT Certified Data Processing Specialist",
        "Statistical Learning",
        "AMCAT Certified Business Analyst"
      ],
      "languages": [],
      "projects": [],
      "raw_text": "Contact\nwww.linkedin.com/in/thesidsat\n(LinkedIn)\nTop Skills\nLangchain\nProgramming\nData Mining\nCertifications\nAMCAT Certified Data Processing\nSpecialist\nStatistical Learning\nAMCAT Certified Business Analyst\nSiddhesh Sathe\nData Scientist\nLondon Area, United Kingdom\nSummary\nI have effectively assisted clients worldwide in meeting their business\nand technical objectives through implementation of data science\nsolutions. My expertise is in leveraging artificial intelligence, and I\nhold a Master's degree in Computer Science with specialization in AI\nfrom University of Leeds.\nCurrently, I am applying my skills and knowledge as a member of the\nTradeTeq team, actively contributing to the company's success.\nThe observations and thoughts shared here are strictly my own and\ndo not reflect the views of any other individual or organization.\nExperience\nTradeteq\nData Scientist\nMay 2022 - March 2025 (2 years 11 months)\nLondon, England, United Kingdom\nRedev Ltd\n2 years 5 months\nArtificial Intelligence Engineer\nNovember 2020 - May 2022 (1 year 7 months)\nLeeds, England, United Kingdom\nActively managed core trading strategies across FX and indices.\nDesigned, developed and backtested Risk Management and profit taking\ncapabilities resulting in higher Alpha.\nAI/Data Science\nEstablished dockerised AI modules with RESTful APIs to streamline transition\nfrom prototyping to deployment.\nDesigned ANNs and LSTMs in predictive modelling.\nExtended YOLO to detect fraud from CCTV feed in a resource constrained\nenvironment.\nAnalytics Consultant\nPage 1 of 2\nJanuary 2020 - October 2020 (10 months)\nLeeds, United Kingdom\nUpwork\nFreelance Data Scientist\nJune 2017 - September 2019 (2 years 4 months)\nFormer Top Rated freelancer - Top 10% of freelancers on the platform.I worked on delivering end to end data science solutions to 20+ clients acrossindustries in computer vision, NLP and machine learning.\nAalborg Universitet\nWinter Intern\nDecember 2016 - December 2016 (1 month)\nCopenhagen Area, Denmark\nForbes Marshall\nIntern(Oracle Dev)\nJune 2016 - June 2016 (1 month)\nEducation\nUniversity of Leeds\nMSc. Advanced Computer Science , Artificial Intelligence ¬∑ (2019 - 2020)\nUniversity of Pune\nBachelor of Engineering (B.E.), Computer Science ¬∑ (2013 - 2017)\nPage 2 of 2",
      "parsed_at": "2025-06-10T02:38:33.190917",
      "file_path": "data\\cvs\\processed\\067b812f2a3744e1a5cb_20250610_023833_1c15f364_067b812f2a3744e1a5cb4e1e21a75ca4_Siddhesh Sathe.txt"
    },
    {
      "candidate_id": "9bb7c4359d0f47309383_20250610_023853_4abacf28",
      "file_name": "9bb7c4359d0f473093830d875f88bd86_Saad LAOUADI.txt",
      "full_name": "Saad Laouadi",
      "contact_info": {
        "email": "dr.saad.laouadi@gmail.com",
        "phone": "+213 670 72 95 61",
        "location": "Boumerdes, Algeria",
        "linkedin": "linkedin.com/in/saad-laouadi",
        "github": "github.com/dr-saad-la"
      },
      "summary": "Data Scientist with seven (7) years of experience and advanced expertise in machine learning, deep learning, and artificial intelligence. Versatile professional with demonstrated success applying data science solutions across diverse sectors including education, health care, cybersecurity, and agriculture. Combines technical proficiency in programming with strong analytical thinking and leadership capabilities. Experienced AI instructor with the ability to communicate complex concepts effectively. Committed to leveraging data-driven insights to solve challenging business problems and drive innovation.",
      "skills": [
        "Python",
        "R",
        "Julia",
        "Rust",
        "SQL",
        "JavaScript",
        "C++",
        "TensorFlow",
        "PyTorch",
        "Keras",
        "scikit-learn",
        "XGBoost",
        "LightGBM",
        "Hugging Face Transformers",
        "Pandas",
        "Polars",
        "NumPy",
        "SciPy",
        "statsmodels",
        "Matplotlib",
        "Seaborn",
        "Plotly",
        "ggplot2",
        "GDAL",
        "QGIS",
        "GeoPandas",
        "PostGIS",
        "OpenCV",
        "YOLO",
        "EfficientNet",
        "UNet",
        "SegNet",
        "Detectron2",
        "Docker",
        "Kubernetes",
        "MLflow",
        "Machine Learning",
        "Deep Learning",
        "Computer Vision Systems",
        "Natural Language Processing",
        "Statistical Analysis & Modeling",
        "AI Model Development & Optimization",
        "Technical Training & Knowledge Transfer",
        "Research & Development",
        "Cross-functional Team Leadership",
        "Domain Adaptation",
        "Data Pipeline Architecture"
      ],
      "experience": [
        {
          "title": "AI Instructor",
          "company": "FREELANCE",
          "start_date": "11/2024",
          "end_date": "Present",
          "duration_months": null,
          "description": "Remote position teaching AI and deep learning courses",
          "achievements": [
            "Developed and delivered comprehensive curriculum on the foundations of deep learning, providing students with both theoretical knowledge and practical implementation skills",
            "Designed specialized course on applying deep learning techniques to sequential data analysis, covering RNNs, LSTMs, and transformers with real-world applications",
            "Created and taught advanced computer vision course, focusing on convolutional neural networks, object detection, and image segmentation techniques",
            "Mentored students through complex AI projects, providing code reviews and implementation guidance",
            "Maintained high student satisfaction ratings through engaging teaching methods and accessible explanations of complex technical concepts"
          ]
        },
        {
          "title": "Data Science Consultant",
          "company": "GROWTECH",
          "start_date": "06/2022",
          "end_date": "10/2024",
          "duration_months": 28,
          "description": "Remote data science consulting role focused on agricultural AI applications",
          "achievements": [
            "Led a specialized team focused on developing AI models for early detection of Red Palm Weevil infestations, a critical agricultural pest",
            "Designed and built computer vision models that achieved 94% accuracy in identifying plant diseases from image data",
            "Created custom deep learning algorithms to detect subtle signs of pest damage before visible symptoms appeared",
            "Collaborated with agronomists to refine model parameters based on field expertise and regional agricultural patterns",
            "Established standardized methodologies for data collection and preparation, improving model training efficiency by 40%"
          ]
        },
        {
          "title": "Statistician / Data Scientist",
          "company": "QATAR ORGANIZATION",
          "start_date": "2018",
          "end_date": "2023",
          "duration_months": 60,
          "description": "Data science and statistical analysis role in Doha, Qatar",
          "achievements": [
            "Architected and implemented a comprehensive data entry system that streamlined information collection and improved data integrity",
            "Developed advanced natural language processing solutions for automated document analysis and information extraction",
            "Created and deployed document classification algorithms",
            "Conducted statistical analysis on large datasets to identify patterns and generate actionable insights for organizational decision-making",
            "Delivered training programs on statistical methods and data analysis techniques to colleagues"
          ]
        }
      ],
      "education": [
        {
          "degree": "Ph.D. in Applied Economics",
          "institution": "BLIDA UNIVERSITY",
          "graduation_year": 2017,
          "gpa": null,
          "field_of_study": "Applied Economics"
        },
        {
          "degree": "Master's Degree in Econometrics",
          "institution": "BLIDA UNIVERSITY",
          "graduation_year": 2012,
          "gpa": null,
          "field_of_study": "Econometrics"
        },
        {
          "degree": "Bachelor's Degree in Economics",
          "institution": "BLIDA UNIVERSITY",
          "graduation_year": 2010,
          "gpa": null,
          "field_of_study": "Economics"
        }
      ],
      "certifications": [
        "Professional Certificate in Data Science, edX (2019)",
        "Machine Learning with R, DataCamp (2020)",
        "Data Scientist with Python, DataCamp (2021)",
        "Data Scientist with R, DataCamp (2021)",
        "Python Programmer, DataCamp (2022)",
        "R Programmer, DataCamp (2022)",
        "SAS Programmer, SAS Corporation (2019)",
        "SAS Data Scientist, SAS Corporation (2019)",
        "Advanced Computer Vision Techniques, Stanford Online (2023)",
        "Natural Language Processing Workshop, AI Conference (2022)",
        "Deep Learning for Time Series Analysis, Workshop (2020)"
      ],
      "languages": [],
      "projects": [
        "Soil Nutrient Optimization System ‚Äî Developed machine learning models to predict optimal nutrient composition based on crop type, soil condition, and climate data",
        "Water Quality Monitoring Network ‚Äî Created real-time anomaly detection system for irrigation water quality using sensor data and time series analysis, identifying contaminants with 94% accuracy",
        "Crop Disease Prediction Model ‚Äî Designed deep learning system to identify early signs of plant diseases from multispectral imagery",
        "Microclimate Mapping for Precision Agriculture ‚Äî Built spatial analysis model combining satellite imagery, ground sensors, and topographical data to enable field-specific planting recommendations",
        "Sustainable Irrigation AI System ‚Äî Developed reinforcement learning algorithm to optimize irrigation scheduling based on weather forecasts, soil moisture, and plant growth stages"
      ],
      "raw_text": "SAAD LAOUADI, PH.D.\nDATA SCIENTIST\n#dr.saad.laouadi@gmail.com ¬É+213 670 72 95 61\n√Ølinkedin.com/in/saad-laouadi ¬ßgithub.com/dr-saad-la\n+ Boumerdes, Algeria\nProfessional Profile\nData Scientist with seven (7) years of experience and advanced expertise in machine learning, deep learning, and artificial\nintelligence. Versatile professional with demonstrated success applying data science solutions across diverse sectors including\neducation, health care, cybersecurity, and agriculture. Combines technical proficiency in programming with strong analytical\nthinking and leadership capabilities. Experienced AI instructor with the ability to communicate complex concepts effectively.\nCommitted to leveraging data-driven insights to solve challenging business problems and drive innovation.\nProfessional Experience\nFREELANCE November 2024 ‚Äì Present\nAI Instructor Remote\n‚Ä¢ Developed and delivered comprehensive curriculum on the foundations of deep learning, providing students with both\ntheoretical knowledge and practical implementation skills\n‚Ä¢ Designed specialized course on applying deep learning techniques to sequential data analysis, covering RNNs, LSTMs, and\ntransformers with real-world applications\n‚Ä¢ Created and taught advanced computer vision course, focusing on convolutional neural networks, object detection, and\nimage segmentation techniques\n‚Ä¢ Mentored students through complex AI projects, providing code reviews and implementation guidance\n‚Ä¢ Maintained high student satisfaction ratings through engaging teaching methods and accessible explanations of complex\ntechnical concepts\nGROWTECH June 2022 ‚Äì October 2024\nData Science Consultant Remote\n‚Ä¢ Led a specialized team focused on developing AI models for early detection of Red Palm Weevil infestations, a critical\nagricultural pest\n‚Ä¢ Designed and built computer vision models that achieved 94% accuracy in identifying plant diseases from image data\n‚Ä¢ Created custom deep learning algorithms to detect subtle signs of pest damage before visible symptoms appeared\n‚Ä¢ Collaborated with agronomists to refine model parameters based on field expertise and regional agricultural patterns\n‚Ä¢ Established standardized methodologies for data collection and preparation, improving model training efficiency by 40\n1\nQATAR ORGANIZATION 2018 ‚Äì 2023\nStatistician / Data Scientist Doha, Qatar\n‚Ä¢ Architected and implemented a comprehensive data entry system that streamlined information collection and improved\ndata integrity\n‚Ä¢ Developed advanced natural language processing solutions for automated document analysis and information extraction\n‚Ä¢ Created and deployed document classification algorithms.\n‚Ä¢ Conducted statistical analysis on large datasets to identify patterns and generate actionable insights for organizational\ndecision-making\n‚Ä¢ Delivered training programs on statistical methods and data analysis techniques to colleagues.\nTechnical Skills\n‚Ä¢ Programming Languages: Python, R, Julia, Rust,\nSQL, JavaScript, C++\n‚Ä¢ Machine Learning: TensorFlow, PyTorch, Keras, scikitlearn,\nXGBoost, LightGBM, Hugging FaceTransformers\n‚Ä¢ Data Analysis: Pandas, Polars, NumPy, SciPy, statsmodels,\nMatplotlib, Seaborn, Plotly, ggplot2\n‚Ä¢ Agriculture Technologies: GDAL, QGIS, GeoPandas,\nPostGIS.\n‚Ä¢ Computer Vision: OpenCV, YOLO, EfficientNet, UNet,\nSegNet, Detectron2\n‚Ä¢ Cloud & Infrastructure: Docker, Kubernetes,\nMLflow.\nSelected Projects\n‚Ä¢ Soil Nutrient Optimization System ‚Äî Developed machine learning models to predict optimal nutrient composition\nbased on crop type, soil condition, and climate data.\n‚Ä¢ Water Quality Monitoring Network‚ÄîCreated real-time anomaly detection system for irrigation water quality using\nsensor data and time series analysis, identifying contaminants with 94% accuracy.\n‚Ä¢ Crop Disease Prediction Model ‚Äî Designed deep learning system to identify early signs of plant diseases from multispectral\nimagery.\n‚Ä¢ Microclimate Mapping for Precision Agriculture‚ÄîBuilt spatial analysis model combining satellite imagery, ground\nsensors, and topographical data to enable field-specific planting recommendations.\n‚Ä¢ Sustainable Irrigation AI System ‚Äî Developed reinforcement learning algorithm to optimize irrigation scheduling\nbased on weather forecasts, soil moisture, and plant growth stages.\nEducation\nBLIDA UNIVERSITY 2013 ‚Äì 2017\nPh.D. in Applied Economics Blida, Algeria\n‚Ä¢ Dissertation focused on statistical and econometric modeling applications in economic analysis\n‚Ä¢ Applied advanced quantitative methods to solve complex economic problems\nBLIDA UNIVERSITY 2010 ‚Äì 2012\nMaster‚Äôs Degree in Econometrics Blida, Algeria\n2\nBLIDA UNIVERSITY 2007 ‚Äì 2010\nBachelor‚Äôs Degree in Economics Blida, Algeria\nAreas of Expertise\n‚Ä¢ Machine Learning & Deep Learning\n‚Ä¢ Computer Vision Systems\n‚Ä¢ Natural Language Processing\n‚Ä¢ Statistical Analysis &Modeling\n‚Ä¢ AIModel Development & Optimization\n‚Ä¢ Technical Training & Knowledge Transfer\n‚Ä¢ Research & Development\n‚Ä¢ Cross-functional Team Leadership\n‚Ä¢ Domain Adaptation (Agriculture, Education, Health\ncare, Cyber security)\n‚Ä¢ Data Pipeline Architecture\nCertifications & Professional Development\nCertifications: Professional Development:\n‚Ä¢ Professional Certificate in Data Science, edX (2019)\n‚Ä¢ Machine Learning with R, DataCamp (2020)\n‚Ä¢ Data Scientist with Python, DataCamp (2021)\n‚Ä¢ Data Scientist with R, DataCamp (2021)\n‚Ä¢ Python Programmer, DataCamp (2022)\n‚Ä¢ R Programmer, DataCamp (2022)\n‚Ä¢ SAS Programmer, SAS Corporation (2019)\n‚Ä¢ SAS Data Scientist, SAS Corporation (2019)\n‚Ä¢ Advanced Computer Vision Techniques, Stanford Online\n(2023)\n‚Ä¢ Natural Language ProcessingWorkshop, AI Conference\n(2022)\n‚Ä¢ Deep Learning for Time Series Analysis, Workshop\n(2020)\n3",
      "parsed_at": "2025-06-10T02:38:53.388351",
      "file_path": "data\\cvs\\processed\\9bb7c4359d0f47309383_20250610_023853_4abacf28_9bb7c4359d0f473093830d875f88bd86_Saad LAOUADI.txt"
    }
  ],
  "screening_results": null,
  "detailed_evaluations": [],
  "interview_questions": [],
  "comparison_analysis": null,
  "session_status": "screening",
  "created_at": "2025-06-10T02:38:13.256870",
  "updated_at": "2025-06-10T02:39:16.074730",
  "metadata": {},
  "configuration": {
    "qualificationThreshold": 70,
    "evaluationMode": "comprehensive",
    "topNCandidates": 5,
    "analysisType": "full",
    "scoringWeights": {
      "technical": 60,
      "experience": 35,
      "culture": 0,
      "soft": 0,
      "education": 5
    },
    "options": {
      "autoGenerateInterviews": true,
      "compareCandidates": true,
      "detailedReports": true,
      "enableBiasDetection": true,
      "predictiveAnalysis": true,
      "marketIntelligence": true
    }
  }
}